{
  "approval_id": "APR-2026-06-19-005",
  "project_id": "PRJ-2026-001",
  "action_type": "chat_message",
  "target_system": "slack",
  "target_id": "#engineering-team",
  "summary": "Post CI pipeline status update to team Slack channel",
  "requested_by": "daily_briefing_agent",
  "status": "pending",
  "created_at": "2026-06-19T08:57:32Z",
  "updated_at": "2026-06-19T08:57:32Z",
  "details": {
    "message_content": "CI pipeline on main branch has been broken since 06:30. All merges are currently blocked. DevOps team is investigating.",
    "channel": "#engineering-team",
    "urgency": "high"
  },
  "audit_ref": "RUN-2026-06-19-001",
  "expires_at": "2026-06-19T17:00:00Z",
  "scope": "once"
}
